{
  "venue": "福島",
  "race_no": 10,
  "race_model": "sealed Reader all-horse comparison; ordinary five fixed first.",
  "marks": [
    9,
    10,
    14,
    2,
    13
  ],
  "mainline_cases": [
    {
      "horse_no": 9,
      "case": "clearest win route"
    },
    {
      "horse_no": 10,
      "case": "next mainline win route"
    },
    {
      "horse_no": 2,
      "case": "retain on comparative support"
    },
    {
      "horse_no": 13,
      "case": "retain on comparative support"
    }
  ],
  "single_shot_case": {
    "horse_no": 14,
    "case": "asymmetric win route"
  },
  "boundary_review": {
    "alternative_horse_no": 7,
    "reason": "challenger 7 does not clearly exceed fixed boundary 13; KEEP"
  },
  "rrdb_refs": [],
  "reader_facing_reason": "honmei 9, second 10, shot 14; r2 fixed-boundary review.",
  "candidate_compression": {
    "ordinary_five": [
      9,
      10,
      14,
      2,
      13
    ],
    "external_challenger_horse_no": 7,
    "external_challenger_case": "one outside horse with asymmetric win route",
    "excluded_horse_no": 7,
    "decision": "KEEP_ORDINARY_FIVE",
    "reason": "fixed boundary 13 retained"
  },
  "role_assignment": {
    "honmei_horse_no": 9,
    "second_horse_no": 10,
    "honmei_win_case": "WIN-first clearest realistic route",
    "second_case": "next strongest mainline route",
    "honmei_selection_mode": "WIN_FIRST_NOT_PLACE_FIRST",
    "shot_selection_mode": "ASYMMETRIC_PAYOUT_ROUTE_NOT_ORDINARY_RANK",
    "ranking_reason": "honmei 9 over second 10 on win-route repeatability"
  }
}
